{"design_hash":"sha256:7fbc208af7b9025de7b23cbdb43a937cdbc9ae8b727fc83b71a964219c17fcca","files":[{"path":"blinker-555.rhoform","sha256":"2f2eee3ed4d6e4c46fc2c112714b2568a437e634cebc9f0b2586d1d9b6f55ddf"},{"path":"rhoform/lib/connector.rhoform","sha256":"179453a99c4f7b70e9e1f1e990d8b8532186e745c5c2461408f0a108c5cf2243"},{"path":"rhoform/lib/mech.rhoform","sha256":"49a338045d06190f9283c6f788857d9df3735eae90f002d39455a0968ec33431"},{"path":"rhoform/lib/passive.rhoform","sha256":"75a0b00eafc8624ccaa2a284840e97188b7ae20a3bc5d31f97bd7524fb3a2584"},{"path":"rhoform/lib/semiconductor.rhoform","sha256":"b69af2844822b356e4e2952c4079c1e4992953936a21a345001e6bd208929cc7"},{"path":"rhoform/lib/timer.rhoform","sha256":"843d6a37620514fb53904bfbef6b3c0c12dcb9a90be8ff983ba81223d464806d"}],"ir_version":0,"nodes":{"/":{"declaration":{"byte_end":595,"byte_start":577,"col_end":19,"col_start":1,"file":0,"line_end":21,"line_start":21},"instantiation_trace":[]},"/assert_duty":{"declaration":{"byte_end":2969,"byte_start":2905,"col_end":69,"col_start":5,"file":0,"line_end":93,"line_start":93},"instantiation_trace":[{"byte_end":2969,"byte_start":2905,"col_end":69,"col_start":5,"file":0,"line_end":93,"line_start":93}]},"/assert_freq":{"declaration":{"byte_end":3041,"byte_start":2974,"col_end":72,"col_start":5,"file":0,"line_end":94,"line_start":94},"instantiation_trace":[{"byte_end":3041,"byte_start":2974,"col_end":72,"col_start":5,"file":0,"line_end":94,"line_start":94}]},"/c_byp":{"declaration":{"byte_end":827,"byte_start":600,"col_end":33,"col_start":5,"file":0,"line_end":27,"line_start":22},"instantiation_trace":[{"byte_end":827,"byte_start":600,"col_end":33,"col_start":5,"file":0,"line_end":27,"line_start":22}]},"/c_ctl":{"declaration":{"byte_end":1057,"byte_start":832,"col_end":33,"col_start":5,"file":0,"line_end":33,"line_start":28},"instantiation_trace":[{"byte_end":1057,"byte_start":832,"col_end":33,"col_start":5,"file":0,"line_end":33,"line_start":28}]},"/c_t":{"declaration":{"byte_end":1292,"byte_start":1062,"col_end":33,"col_start":5,"file":0,"line_end":39,"line_start":34},"instantiation_trace":[{"byte_end":1292,"byte_start":1062,"col_end":33,"col_start":5,"file":0,"line_end":39,"line_start":34}]},"/indicator":{"declaration":{"byte_end":1373,"byte_start":1297,"col_end":81,"col_start":5,"file":0,"line_end":40,"line_start":40},"instantiation_trace":[{"byte_end":1373,"byte_start":1297,"col_end":81,"col_start":5,"file":0,"line_end":40,"line_start":40}]},"/indicator/d1":{"declaration":{"byte_end":262,"byte_start":94,"col_end":35,"col_start":5,"file":0,"line_end":9,"line_start":6},"instantiation_trace":[{"byte_end":262,"byte_start":94,"col_end":35,"col_start":5,"file":0,"line_end":9,"line_start":6},{"byte_end":1373,"byte_start":1297,"col_end":81,"col_start":5,"file":0,"line_end":40,"line_start":40}]},"/indicator/r_lim":{"declaration":{"byte_end":466,"byte_start":267,"col_end":39,"col_start":5,"file":0,"line_end":14,"line_start":10},"instantiation_trace":[{"byte_end":466,"byte_start":267,"col_end":39,"col_start":5,"file":0,"line_end":14,"line_start":10},{"byte_end":1373,"byte_start":1297,"col_end":81,"col_start":5,"file":0,"line_end":40,"line_start":40}]},"/j_bat":{"declaration":{"byte_end":1477,"byte_start":1378,"col_end":46,"col_start":5,"file":0,"line_end":42,"line_start":41},"instantiation_trace":[{"byte_end":1477,"byte_start":1378,"col_end":46,"col_start":5,"file":0,"line_end":42,"line_start":41}]},"/mh1":{"declaration":{"byte_end":1615,"byte_start":1482,"col_end":19,"col_start":5,"file":0,"line_end":46,"line_start":43},"instantiation_trace":[{"byte_end":1615,"byte_start":1482,"col_end":19,"col_start":5,"file":0,"line_end":46,"line_start":43}]},"/r_a":{"declaration":{"byte_end":1819,"byte_start":1620,"col_end":40,"col_start":5,"file":0,"line_end":51,"line_start":47},"instantiation_trace":[{"byte_end":1819,"byte_start":1620,"col_end":40,"col_start":5,"file":0,"line_end":51,"line_start":47}]},"/r_b":{"declaration":{"byte_end":2023,"byte_start":1824,"col_end":40,"col_start":5,"file":0,"line_end":56,"line_start":52},"instantiation_trace":[{"byte_end":2023,"byte_start":1824,"col_end":40,"col_start":5,"file":0,"line_end":56,"line_start":52}]},"/timer":{"declaration":{"byte_end":2166,"byte_start":2028,"col_end":29,"col_start":5,"file":0,"line_end":60,"line_start":57},"instantiation_trace":[{"byte_end":2166,"byte_start":2028,"col_end":29,"col_start":5,"file":0,"line_end":60,"line_start":57}]},"/tp_out":{"declaration":{"byte_end":2264,"byte_start":2171,"col_end":25,"col_start":5,"file":0,"line_end":63,"line_start":61},"instantiation_trace":[{"byte_end":2264,"byte_start":2171,"col_end":25,"col_start":5,"file":0,"line_end":63,"line_start":61}]},"GND":{"declaration":{"byte_end":2404,"byte_start":2269,"col_end":18,"col_start":5,"file":0,"line_end":70,"line_start":64},"instantiation_trace":[{"byte_end":2404,"byte_start":2269,"col_end":18,"col_start":5,"file":0,"line_end":70,"line_start":64}]},"N_CTL":{"declaration":{"byte_end":2481,"byte_start":2409,"col_end":18,"col_start":5,"file":0,"line_end":73,"line_start":71},"instantiation_trace":[{"byte_end":2481,"byte_start":2409,"col_end":18,"col_start":5,"file":0,"line_end":73,"line_start":71}]},"N_DIS":{"declaration":{"byte_end":2570,"byte_start":2486,"col_end":18,"col_start":5,"file":0,"line_end":77,"line_start":74},"instantiation_trace":[{"byte_end":2570,"byte_start":2486,"col_end":18,"col_start":5,"file":0,"line_end":77,"line_start":74}]},"N_TH":{"declaration":{"byte_end":2677,"byte_start":2575,"col_end":19,"col_start":5,"file":0,"line_end":82,"line_start":78},"instantiation_trace":[{"byte_end":2677,"byte_start":2575,"col_end":19,"col_start":5,"file":0,"line_end":82,"line_start":78}]},"OUT":{"declaration":{"byte_end":2775,"byte_start":2682,"col_end":17,"col_start":5,"file":0,"line_end":86,"line_start":83},"instantiation_trace":[{"byte_end":2775,"byte_start":2682,"col_end":17,"col_start":5,"file":0,"line_end":86,"line_start":83}]},"VCC":{"declaration":{"byte_end":2900,"byte_start":2780,"col_end":18,"col_start":5,"file":0,"line_end":92,"line_start":87},"instantiation_trace":[{"byte_end":2900,"byte_start":2780,"col_end":18,"col_start":5,"file":0,"line_end":92,"line_start":87}]},"indicator/N_IND_LED":{"declaration":{"byte_end":542,"byte_start":471,"col_end":16,"col_start":5,"file":0,"line_end":17,"line_start":15},"instantiation_trace":[{"byte_end":542,"byte_start":471,"col_end":16,"col_start":5,"file":0,"line_end":17,"line_start":15},{"byte_end":1373,"byte_start":1297,"col_end":81,"col_start":5,"file":0,"line_end":40,"line_start":40}]}},"sourcemap_version":0}
